Job Title,Company Name,Job Description,Location,Salary Range,Job Type,Posted Date,Job URL,Platform,Skills,Experience Level,Industry,Company Size,Scraped At
Software Engineer,TechCorp Inc,We are looking for a skilled software engineer to join our team. You will be responsible for developing and maintaining web applications.,Remote,$80,000 - $120,000,Full-time,2024-01-15,https://example.com/job/1,naukri,Python,JavaScript,React,3-5 Years,Technology,50-200,2024-01-20 10:30:00
Data Scientist,Data Analytics Co,Join our data science team to analyze complex datasets and build predictive models.,Bengaluru,$90,000 - $140,000,Full-time,2024-01-10,https://example.com/job/2,naukri,Python,Machine Learning,SQL,5-7 Years,Analytics,100-500,2024-01-20 10:30:00
Frontend Developer,Web Solutions Inc,Looking for an experienced frontend developer to build responsive web applications.,Remote,$70,000 - $100,000,Contract,2024-01-18,https://example.com/job/3,remoteok,JavaScript,React,CSS,2-4 Years,Technology,10-50,2024-01-20 10:30:00
DevOps Engineer,Cloud Systems,Manage cloud infrastructure and implement CI/CD pipelines.,Mumbai,$85,000 - $130,000,Full-time,2024-01-12,https://example.com/job/4,naukri,AWS,Docker,Kubernetes,4-6 Years,Technology,200-500,2024-01-20 10:30:00
Product Manager,Innovate Tech,Lead product development and work with cross-functional teams.,Remote,$100,000 - $150,000,Full-time,2024-01-08,https://example.com/job/5,remoteok,Product Management,Agile,Scrum,5-8 Years,Technology,100-200,2024-01-20 10:30:00